{
  "scenario_id": "SCN_CLASS0_E003_SMOKE",
  "title": "Class 0 E003 smoke emergency scenario",
  "description": "Deterministic scenario skeleton for a representative E003-aligned smoke-detected emergency path.",
  "category": "class0_emergency",
  "mode": "deterministic",
  "input_plane": {
    "protocol": "mqtt",
    "ingress_topic": "smarthome/context/raw",
    "audit_topic": "smarthome/audit/validator_output"
  },
  "preconditions": {
    "requires_mac_mini_runtime": true,
    "requires_rpi_evaluation_runtime": true,
    "requires_synced_phase0_assets": true,
    "requires_time_sync_healthy": true
  },
  "steps": [
    {
      "step_id": 1,
      "action": "publish_context_payload",
      "description": "Publish a smoke-detected emergency style payload through the operational ingress plane.",
      "payload_fixture": "integration/tests/data/sample_policy_router_input_class0_e003_smoke.json"
    },
    {
      "step_id": 2,
      "action": "observe_audit_stream",
      "description": "Observe the verification-safe audit stream and capture the emergency routing outcome.",
      "expected_fixture": "integration/tests/data/expected_routing_class0_e003_smoke.json"
    }
  ],
  "expected_outcomes": {
    "route_class": "CLASS_0",
    "routing_target": "CLASS_0",
    "llm_invocation_allowed": false,
    "unsafe_autonomous_actuation_allowed": false,
    "canonical_emergency_family": "E003"
  },
  "notes": [
    "Dedicated E003 smoke-detected payload fixture now available in sample_policy_router_input_class0_e003_smoke.json.",
    "This scenario validates smoke-detected state trigger semantics and is aligned with the required experiments document's canonical emergency family coverage."
  ]
}
