{
  "scenario_id": "SCN_BASELINE_TEMPLATE_001",
  "title": "Baseline integration scenario skeleton",
  "description": "Template scenario for deterministic end-to-end integration validation. This file is not canonical policy truth and must remain aligned with frozen assets under common/.",
  "category": "baseline",
  "mode": "deterministic",
  "input_plane": {
    "protocol": "mqtt",
    "ingress_topic": "safe_deferral/context/input",
    "audit_topic": "safe_deferral/audit/log"
  },
  "preconditions": {
    "requires_mac_mini_runtime": true,
    "requires_rpi_evaluation_runtime": true,
    "requires_synced_phase0_assets": true,
    "requires_time_sync_healthy": true,
    "requires_mqtt_registry_alignment": true,
    "requires_policy_schema_alignment": true
  },
  "steps": [
    {
      "step_id": 1,
      "action": "publish_context_payload",
      "description": "Publish a policy-aligned context payload through the registry-aligned MQTT input plane used by the operational system.",
      "payload_fixture": "integration/tests/data/sample_policy_router_input_class1.json"
    },
    {
      "step_id": 2,
      "action": "observe_audit_stream",
      "description": "Subscribe to the verification-safe audit stream and capture the routing outcome.",
      "expected_fixture": "integration/tests/data/expected_routing_class1.json"
    }
  ],
  "expected_outcomes": {
    "route_class": "CLASS_1",
    "routing_target": "CLASS_1",
    "llm_invocation_allowed": true,
    "llm_decision_invocation_allowed": true,
    "llm_guidance_generation_allowed": true,
    "unsafe_autonomous_actuation_allowed": false,
    "allowed_action_catalog_ref": "common/policies/low_risk_actions.json",
    "doorlock_autonomous_execution_allowed": false
  },
  "notes": [
    "Thresholds, trigger predicates, and action-domain assumptions must be derived from frozen assets rather than hardcoded here.",
    "Clone this file to create deterministic Class 0, Class 1, Class 2, stale, missing-state, or conflict scenarios.",
    "Class 1 autonomous execution must remain limited to the frozen low-risk lighting catalog; doorlock-sensitive behavior must not be represented as Class 1 execution.",
    "Schema-governed context fixtures referenced by this scenario should include environmental_context.doorbell_detected."
  ]
}
