{
  "scenario_id": "SCN_CLASS0_E002_BUTTON_TRIPLE_HIT",
  "title": "Class 0 E002 emergency button triple-hit scenario",
  "description": "Deterministic scenario skeleton for a representative E002-aligned emergency path (bounded input triple-hit). This file is an integration asset and must remain aligned with frozen assets under common/.",
  "category": "class0_emergency",
  "mode": "deterministic",
  "input_plane": {
    "protocol": "mqtt",
    "ingress_topic": "smarthome/context/raw",
    "audit_topic": "smarthome/audit/validator_output"
  },
  "preconditions": {
    "requires_mac_mini_runtime": true,
    "requires_rpi_evaluation_runtime": true,
    "requires_synced_phase0_assets": true,
    "requires_time_sync_healthy": true
  },
  "steps": [
    {
      "step_id": 1,
      "action": "publish_context_payload",
      "description": "Publish an emergency-aligned bounded-input triple-hit payload through the same operational ingress plane.",
      "payload_fixture": "integration/tests/data/sample_policy_router_input_class0_e002_button_triple_hit.json"
    },
    {
      "step_id": 2,
      "action": "observe_audit_stream",
      "description": "Observe the verification-safe audit stream and capture the emergency routing outcome.",
      "expected_fixture": "integration/tests/data/expected_routing_class0_e002_button_triple_hit.json"
    }
  ],
  "expected_outcomes": {
    "route_class": "CLASS_0",
    "routing_target": "CLASS_0",
    "llm_invocation_allowed": false,
    "unsafe_autonomous_actuation_allowed": false,
    "canonical_emergency_family": "E002"
  },
  "notes": [
    "Exact trigger semantics remain defined by the frozen policy table.",
    "This scenario is intended for emergency override path validation and later class-wise latency profiling."
  ]
}
