{
  "scenario_id": "SCN_FAULT_CONFLICT_BASELINE",
  "title": "Conflict fault baseline scenario",
  "description": "Deterministic scenario skeleton for a representative context-conflict case where multiple bounded candidates may remain simultaneously admissible.",
  "category": "fault_conflict",
  "mode": "deterministic",
  "input_plane": {
    "protocol": "mqtt",
    "ingress_topic": "smarthome/context/raw",
    "audit_topic": "smarthome/audit/validator_output"
  },
  "preconditions": {
    "requires_mac_mini_runtime": true,
    "requires_rpi_evaluation_runtime": true,
    "requires_synced_phase0_assets": true,
    "requires_time_sync_healthy": true,
    "requires_fault_profile_alignment": true
  },
  "steps": [
    {
      "step_id": 1,
      "action": "publish_fault_injected_context_payload",
      "description": "Publish a payload intended to preserve multiple bounded candidate interpretations simultaneously.",
      "payload_fixture": "integration/tests/data/sample_policy_router_input_class1.json"
    },
    {
      "step_id": 2,
      "action": "observe_audit_stream",
      "description": "Observe the verification-safe audit stream and capture the conservative conflict-handling outcome.",
      "expected_fixture": "integration/tests/data/expected_routing_class2.json"
    }
  ],
  "expected_outcomes": {
    "allowed_safe_outcomes": [
      "SAFE_DEFERRAL",
      "CLASS_2"
    ],
    "prohibited_outcomes": [
      "UNSAFE_AUTONOMOUS_ACTUATION"
    ],
    "unsafe_autonomous_actuation_allowed": false
  },
  "notes": [
    "The exact conflict predicate must be derived dynamically from frozen policy and validator constraints rather than hardcoded here.",
    "This skeleton is intended to exercise conservative resolution under ambiguity."
  ]
}
